[
  {
    "name": "elastomer emergence in flight",
    "requestChanges": [],
    "requestSchemaValid": true,
    "expectedPolicy": "spring"
  },
  {
    "name": "time zero shows only the source content",
    "requestChanges": [
      {
        "path": "/time",
        "value": 0
      }
    ],
    "requestSchemaValid": true,
    "expectedPolicy": "spring"
  },
  {
    "name": "settled emergence shows only the destination content",
    "requestChanges": [
      {
        "path": "/time",
        "value": 1
      }
    ],
    "requestSchemaValid": true,
    "expectedPolicy": "spring"
  },
  {
    "name": "cancelled emergence continues from the retained state",
    "requestChanges": [
      {
        "path": "/time",
        "value": 0.02
      },
      {
        "path": "/emerged",
        "value": false
      },
      {
        "path": "/channels",
        "value": {
          "progress": {
            "dynamics": {
              "schemaVersion": "0.1.0",
              "mass": 1,
              "stiffness": 1600,
              "damping": 56,
              "positionThreshold": 0.0001,
              "velocityThreshold": 0.01
            },
            "initial": {
              "position": 0.6,
              "velocity": 2
            }
          },
          "opacity": {
            "dynamics": {
              "schemaVersion": "0.1.0",
              "mass": 1,
              "stiffness": 1600,
              "damping": 80,
              "positionThreshold": 0.0001,
              "velocityThreshold": 0.01
            },
            "initial": {
              "position": 0.7,
              "velocity": 1
            }
          }
        }
      }
    ],
    "requestSchemaValid": true,
    "expectedPolicy": "spring"
  },
  {
    "name": "a cancelled emergence settles on the source without destination content",
    "requestChanges": [
      {
        "path": "/time",
        "value": 1
      },
      {
        "path": "/emerged",
        "value": false
      },
      {
        "path": "/channels",
        "value": {
          "progress": {
            "dynamics": {
              "schemaVersion": "0.1.0",
              "mass": 1,
              "stiffness": 1600,
              "damping": 56,
              "positionThreshold": 0.0001,
              "velocityThreshold": 0.01
            },
            "initial": {
              "position": 0.6,
              "velocity": 2
            }
          },
          "opacity": {
            "dynamics": {
              "schemaVersion": "0.1.0",
              "mass": 1,
              "stiffness": 1600,
              "damping": 80,
              "positionThreshold": 0.0001,
              "velocityThreshold": 0.01
            },
            "initial": {
              "position": 0.7,
              "velocity": 1
            }
          }
        }
      }
    ],
    "requestSchemaValid": true,
    "expectedPolicy": "spring"
  },
  {
    "name": "overshooting progress is projected to the destination outline",
    "requestChanges": [
      {
        "path": "/time",
        "value": 0.08
      },
      {
        "path": "/channels/progress",
        "value": {
          "dynamics": {
            "schemaVersion": "0.1.0",
            "mass": 1,
            "stiffness": 1600,
            "damping": 24,
            "positionThreshold": 0.0001,
            "velocityThreshold": 0.01
          },
          "initial": {
            "position": 0,
            "velocity": 0
          }
        }
      }
    ],
    "requestSchemaValid": true,
    "expectedPolicy": "spring"
  },
  {
    "name": "an initial opacity below zero delays the destination content",
    "requestChanges": [
      {
        "path": "/time",
        "value": 0
      },
      {
        "path": "/channels/opacity",
        "value": {
          "dynamics": {
            "schemaVersion": "0.1.0",
            "mass": 1,
            "stiffness": 1600,
            "damping": 80,
            "positionThreshold": 0.0001,
            "velocityThreshold": 0.01
          },
          "initial": {
            "position": -1,
            "velocity": 0
          }
        }
      }
    ],
    "requestSchemaValid": true,
    "expectedPolicy": "spring"
  },
  {
    "name": "frost uses the spring policy",
    "requestChanges": [
      {
        "path": "/family",
        "value": "frost"
      },
      {
        "path": "/time",
        "value": 0.05
      }
    ],
    "requestSchemaValid": true,
    "expectedPolicy": "spring"
  },
  {
    "name": "cast is immediate",
    "requestChanges": [
      {
        "path": "/family",
        "value": "cast"
      },
      {
        "path": "/time",
        "value": 0.01
      }
    ],
    "requestSchemaValid": true,
    "expectedPolicy": "castImmediate"
  },
  {
    "name": "reduced motion gives the destination at time zero",
    "requestChanges": [
      {
        "path": "/reducedMotion",
        "value": true
      },
      {
        "path": "/time",
        "value": 0
      }
    ],
    "requestSchemaValid": true,
    "expectedPolicy": "reducedMotion"
  },
  {
    "name": "reduced motion keeps the source when not emerged",
    "requestChanges": [
      {
        "path": "/reducedMotion",
        "value": true
      },
      {
        "path": "/emerged",
        "value": false
      },
      {
        "path": "/time",
        "value": 0.2
      }
    ],
    "requestSchemaValid": true,
    "expectedPolicy": "reducedMotion"
  },
  {
    "name": "right to left quartic outlines interpolate each logical corner",
    "requestChanges": [
      {
        "path": "/from/outline",
        "value": {
          "schemaVersion": "0.1.0",
          "size": {
            "width": 64,
            "height": 40
          },
          "radii": {
            "topStart": {
              "x": 18,
              "y": 10
            },
            "topEnd": {
              "x": 10,
              "y": 10
            },
            "bottomEnd": {
              "x": 20,
              "y": 14
            },
            "bottomStart": {
              "x": 8,
              "y": 12
            }
          },
          "layoutDirection": "rtl",
          "curvature": "quartic",
          "minimumInset": 2
        }
      },
      {
        "path": "/to/outline",
        "value": {
          "schemaVersion": "0.1.0",
          "size": {
            "width": 96,
            "height": 56
          },
          "radii": {
            "topStart": {
              "x": 28,
              "y": 20
            },
            "topEnd": {
              "x": 12,
              "y": 16
            },
            "bottomEnd": {
              "x": 24,
              "y": 24
            },
            "bottomStart": {
              "x": 10,
              "y": 30
            }
          },
          "layoutDirection": "rtl",
          "curvature": "quartic",
          "minimumInset": 4
        }
      }
    ],
    "requestSchemaValid": true,
    "expectedPolicy": "spring"
  },
  {
    "name": "a negative sweep offset moves the reservation the other way",
    "requestChanges": [
      {
        "path": "/sweepOffset",
        "value": {
          "x": -2,
          "y": -3
        }
      }
    ],
    "requestSchemaValid": true,
    "expectedPolicy": "spring"
  },
  {
    "name": "gel is rejected",
    "requestChanges": [
      {
        "path": "/family",
        "value": "gel"
      }
    ],
    "requestSchemaValid": true,
    "errorContains": "Gel"
  },
  {
    "name": "two identities are rejected",
    "requestChanges": [
      {
        "path": "/to/identity",
        "value": "badge"
      }
    ],
    "requestSchemaValid": true,
    "errorContains": "identity"
  },
  {
    "name": "outlines with different directions are rejected",
    "requestChanges": [
      {
        "path": "/to/outline/layoutDirection",
        "value": "rtl"
      }
    ],
    "requestSchemaValid": true,
    "errorContains": "direction"
  },
  {
    "name": "outlines with different curvature are rejected",
    "requestChanges": [
      {
        "path": "/to/outline/curvature",
        "value": "quartic"
      }
    ],
    "requestSchemaValid": true,
    "errorContains": "curvature"
  },
  {
    "name": "opacity that can overshoot is rejected",
    "requestChanges": [
      {
        "path": "/channels/opacity",
        "value": {
          "dynamics": {
            "schemaVersion": "0.1.0",
            "mass": 1,
            "stiffness": 1600,
            "damping": 60,
            "positionThreshold": 0.0001,
            "velocityThreshold": 0.01
          },
          "initial": {
            "position": 0,
            "velocity": 0
          }
        }
      }
    ],
    "requestSchemaValid": true,
    "errorContains": "overshoot"
  },
  {
    "name": "reduced motion still validates the opacity dynamics",
    "requestChanges": [
      {
        "path": "/reducedMotion",
        "value": true
      },
      {
        "path": "/channels/opacity",
        "value": {
          "dynamics": {
            "schemaVersion": "0.1.0",
            "mass": 1,
            "stiffness": 1600,
            "damping": 60,
            "positionThreshold": 0.0001,
            "velocityThreshold": 0.01
          },
          "initial": {
            "position": 0,
            "velocity": 0
          }
        }
      }
    ],
    "requestSchemaValid": true,
    "errorContains": "overshoot"
  },
  {
    "name": "visible destination content outside the sampled face is rejected",
    "requestChanges": [
      {
        "path": "/time",
        "value": 0.01
      },
      {
        "path": "/to/content",
        "value": {
          "x": -6,
          "y": 6,
          "width": 76,
          "height": 28
        }
      }
    ],
    "requestSchemaValid": true,
    "errorContains": "content"
  },
  {
    "name": "hidden destination content is not checked",
    "requestChanges": [
      {
        "path": "/time",
        "value": 0
      },
      {
        "path": "/to/content",